{
  "schema_version": "1.1", "configuration_id": "migration-fixture", "vehicle": { "id": "sprinter-144-hr", "name": "Sprinter · 144\" WB High Roof", "wheelbase": "144\"", "wall": "driver", "geometry_revision": null },
  "placements": [{ "id": "placement-1", "sku": "22-3438", "wall": "driver", "position": { "x": 12, "y": 0 } }], "infrastructure": [], "exterior_equipment": [], "validation": [],
  "totals": { "wall_usage": {}, "payload": {}, "package_value": null }, "dealer_notes": "",
  "catalog_revisions": [{ "manufacturer": "unresolved", "sku": "22-3438", "revision": null, "status": "unresolved" }], "package_origin": null, "unplaced_items": [],
  "engineering_data": { "status": "unresolved", "geometry_revision_status": "unresolved", "catalog_revision_status": "unresolved" }
}
